,titles,category
278,김경율  비대위 사퇴  또는  불출마  하면 갈등 봉합 ,Politics
279, 자막뉴스     온대서 기다렸는데 당했다    울분 토한 서천 상인들,Politics
280, 공관위원장  후보간 인신공격 엄격 조처  계파 과열경쟁 경고 종합 ,Politics
281,대통령실  서천 상인 분노에 해명  상인    명 만나 위로 ,Politics
282,친윤  김경율  비대위원 사퇴해야     사퇴 생각 없다 ,Politics
283,이낙연 신당 미래대연합 우선 합칠 듯,Politics
284,김은혜 김병욱    기 신도시 특별법  신경전  국민은 두 번 속지 않아      속기록 보고 오라 ,Politics
285, 격전지 속으로  보수세 확산이냐 저지냐  민심 가늠자  강동갑,Politics
286, 영상   한동훈       티셔츠 꽃게 제스쳐로 유난 떨더니 결국 반공 올드보이  ,Politics
287,이준석   차 약속대련은 한동훈 우세승    차전 있을 것 ,Politics
288, 아는기자 갈등 봉합 위한 대통령실의  두 가지 조건  ,Politics
289,민주당 공천 갈등은 현재진행형  수박 이어 멜론도 나가라 ,Politics
290, 친명  양이원영  비명 양기대에 도전장 민주  자객 출마  논란 지속,Politics
291,김경율   마리 앙투아네트  발언  김건희 여사와 비교 아냐 ,Politics
292, 뉴스추적  윤석열 한동훈 갈등 봉합 국면 관건은 김경율 거취,Politics
293, 아는기자 한동훈  윤 대통령에    도 인사 ,Politics
294,윤 대통령  참모진 설득에  한동훈 만나겠다 ,Politics
295,현역 출마 공약 러시  대전 정치권 총선 레이스 분주,Politics
296,친명  비명 지역구 잇단 출사표   집안싸움 위험 수위,Politics
297,또 비명 저격 출마 선언 과열 경쟁 우려에 홍익표  경쟁자 존중을 ,Politics
298,윤  같이 타자  한  자리 있습니까  열차 동승해 서울로,Politics
299,방심위      바이든 날리면  보도 재심의,Politics
300, 대통령 취임 후 국민의힘  원톱   번 교체    년지기 한동훈은   이슈  ,Politics
301,   사진만 찍고 갔다  항의 소동에  허은아    어깨 두드리며 상인 눈물 외면 ,Politics
302,대통령실 한동훈 갈등 수습 봉합 국면,Politics
303,김은혜  재건축이 국민 삶 망가뜨린다는 민주당 발상 김병욱  분당 주민 앞서 당부터 설득해야 ,Politics
304,민주당 공관위  국회의원 입후보자 간 인신공격 엄격히 조처 ,Politics
305,국방위원장   우리 북한 에     은  옆집 돌   이재명 망언  비참한 안보관 ,Politics
306,눈 맞으며   기다린 한동훈   폴더 인사 로 갈등 봉합,Politics
307,                응집력 급격히 약화된 친윤  홍위병 ,Politics
308,여야 원로들  당정  국민에 안정감 줘야  갈등만 거듭하면 무책임  지적,Politics
309,먼저 온 한동훈   에   도 인사 공멸 위기감에  극적인 봉합   당정 갈등 일단락 ,Politics
310, 명품백 의혹  사태 공개 사과는 없을 듯  제 부속실 설치 규모 시기 등 놓고 고심  당정 갈등 일단락 ,Politics
311,     도 인사 하자     어깨 툭  쳐  민생 얘기만 주고 받았다 ,Politics
312, 이재명이 제안  이언주  탈당  일만에 민주당 복당  고심 ,Politics
313, 이낙연 신당 에 싸늘한 호남  지대 광주 출마 압박,Politics
314,잿더미 바라보며 갈등 불끄기  어디 장소가 없어서  비판도,Politics
315,한동훈    존중 신뢰 변함없다    민생 고리로 파국 피했다,Politics
316,공지영  조국에 실망했다  하태경  진심으로 응원한다 ,Politics
317, 국정 기조 안 바꾸면 대통령도 불행해진다 ,Politics
318,트럼프 헤일리  양자구도 첫 대결,Politics
319,민주당  잿더미 된 시장을  브로맨스 화해쇼  배경으로 삼나 ,Politics
320,이재명  대장동 재판  출석했다 몸 상태 악화로 오후 퇴정 종합 ,Politics
321,  정청래  예비후보  명 후원회장  시끌   친명 또  자객 출마 ,Politics
322,보수논객마저 쓴소리    잿더미서 윤석열 한동훈 화해연극  ,Politics
323,   한동훈 만남이 주목적    일부 상인들  아무말 없이 갔다  분통,Politics
324,윤 대통령  장악력  훼손 윤 한 충돌 봉합의 정치적 후과는 ,Politics
325,이재명    일 만에 열린 대장동 재판서 중도 퇴정,Politics
326,     도 숙여 인사     어깨 툭 치며 악수,Politics
327,윤 대통령  열차 같이 탑시다     대통령 존중  일단 갈등 봉합,Politics
328, 윤석열 당선  등 공신 은 추미애인데      키운 임종석 노영민 석고대죄하라 ,Politics
329,    강성희 강퇴 진상규명  운영위 단독소집    불참에 파행,Politics
330, 파워게임       한동훈   조기 봉합  수순 뇌관은 여전 정다운의 뉴스톡 ,Politics
331, 함께 한 추억  특검 점퍼 입은     한동훈    도 인사 ,Politics
332, 영상   결혼 안 하고  애도 키워보지 않고 헛소리 남발  이준석 직격한 노인회장에 이병태 교수  정말 꼰대들의 막말 ,Politics
333,법무부 장관에 박성재 윤 대통령 대구 좌천 때 고검장,Politics
334,노영민  더이상 분열은 안 돼  총선 불출마 압박 일축,Politics
335,한 총리  전재산 기부  고 신언임 여사에  따뜻한 미소 오래 기억하리 ,Politics
336, 팩트체크  홍익표  원전 사용 반도체 해외 못팔아   애플은 원전도 가능,Politics
337,손잡거나 발목 잡거나 부산 여 현역 구청장 시너지  극과 극 ,Politics
338,문제는  국민 눈높이   당 용산  완전한 원팀  시간 걸릴 듯,Politics
339,민주 최고위원 정청래  후원회장 맡아  시끌  공천 계파 갈등 격화,Politics
340, 확전  피했지만  대통령 한동훈 화해 바라보는 두 시선,Politics
341,미래대연합   이낙연 신당  새로운미래와 이르면 이번 주 통합,Politics
342, 르포       정치적 말 대신 열차 동승으로  봉합  메시지,Politics
343,한동훈  열차에 자리 있습니까  윤석열  같이 올라가자 ,Politics
344, 화재 현장 따로 가면 이상해        회의 도중 한동훈과 만남 결정,Politics
345,금태섭 신당  노인 무임승차제 유지 확장   폐지  이준석과 입장차,Politics
346, 연합뉴스 이 시각 헤드라인         ,Politics
347,윤 한  깜짝 회동  막전막후 한 방문 소식에 윤 시간 앞당겨,Politics
348, 김건희 리스크 사천 논란    갈등 뇌관은 그대로,Politics
349,서천시장 일부 상인    사진만 찍고 가  항의 야권  현장 쇼통으로 복장만 터져 ,Politics
350,   시장 화재 현장은    한동훈  정치쇼 무대 아냐 ,Politics
351,갈등 노출 이틀 만에 조우   한동훈  신뢰 변함 없어 ,Politics
352,   열차 같이 탑시다    동승 화답     년 인연  파국 피했다,Politics
353,올  월부터   개월 복무 병사도 예비역 부사관 임용 가능,Politics
354,  저격수  변신한 이언주  년만에 민주당 귀환하나,Politics
355, 강성희 사태  끝까지 간다는 민주당   대통령 사과하라 ,Politics
356,제 지대 흐지부지될라    말 초가 통합 데드라인 ,Politics
357,김경율 비대위원    가 만만합니까  지역 정치권 성토 한목소리,Politics
358,  리포트  이준석  윤 한 갈등   같은 중국집  이론 불식 의도 ,Politics
359, 일만에 봉합된     갈등  공천권  등 이견 좁힐까,Politics
360,박지원  이낙연  호남  석도    한동훈  갈등 봉합  이준석     차전  이재명  이언주 복당 권유,Politics
361,   눈바람 맞으며    도 인사     어깨 툭치며 손 내밀어,Politics
362, 언제든 다시 터질 시한폭탄  용산  명품백 논란  해법 고심,Politics
363, 선거 지면 돌아갈 곳 없다  한동훈 배수진,Politics
364,박지원의 예언  한동훈  결국 항복하고  용핵관  대거 공천할 것 ,Politics
365,총선 앞 현실론에 갈등 봉합한      대통령님에 대해 깊은 존중과 신뢰 ,Politics
366, 대통령에 깊은 존중과 신뢰   김경율   명품백   물었더니   현장영상 ,Politics
367,   아침회의서  한동훈 서천 온다  보고 받고 흔쾌히  가자 ,Politics
368, 윤 한 갈등  봉합 수순 한  깊은 존중과 신뢰 변함 없어  종합 ,Politics
369, 탈당만 세 번  이언주 전 의원  돌고돌아 민주당 재입당할 듯,Politics
370,이재명  이언주에 복당 권유    진지하게 고민하겠다 ,Politics
371,윤 대통령  한 위원장 어깨  툭  미소  이틀 만에  화해 모드 ,Politics
372,조응천  친명 원외  수박 나가니까 친문 이해찬계도 나가라고 압박 ,Politics
373,서로 일정 조절한       도 인사에 상경열차도 동승,Politics
374,윤석열 한동훈  서천화재 공동 대처  갈등 불씨는 남아,Politics
375, 강성희 퇴장  국회 운영위 파행    경호법 위반       사과하라 ,Politics
376, 한동훈도 서천 온답니다    현장 방문 계획하던  과 통했다,Politics
377,한동훈이 여당 내 야당        갈등 봉합에도 불안한  ,Politics
378, 국힘 탈당  이언주에 이재명 복당 권유    고민하겠다 ,Politics
379,한동훈  대통령 깊은 존중 신뢰 변함없어   김건희 명품백 엔 침묵,Politics
380,비명 지역구 노리는 친명 비례 의원들    선명성  경쟁 조짐,Politics
381,이언주  이재명 복당 제안에 고심중 ,Politics
382, 단독   문재인 대통령의 입  강민석 전 청와대 대변인  민주당 입당,Politics
383,윤 대통령과 한동훈  정치적 갈등일까  인간적 손절일까  중립기어 라이브 ,Politics
384,민주  사천이든 공천이든 대통령실  총선 개입 ,Politics
385,김주영  지역 숙원 인하대병원 설립 논의   대학 측 설립 의지 확고 ,Politics
386, 외식비 줄이지 애들 공부시킬 돈은 안 줄여  민주로 간  전직 현대차 사장 의 비판,Politics
387, 분열은 공멸  공감대  갈등봉합 나선 당정  해법은 숙제,Politics
388,민주당  선거제  변심에 정의당  가시밭길 예고,Politics
389,갈등 봉합  윤 대통령 만난 한동훈  민생 얘기만 했다 ,Politics
390, 국회 우습나    분만에 끝난  강성희 강제 퇴장  운영위  여심야심 ,Politics
391,야권  화재 현장을 화해 현장 활용  공격,Politics
392,이재명   윤 정부 저격  이언주에 복당 권유    고민하겠다 ,Politics
393,  한동훈 충돌 봉합    김건희 성역화  되레 강화됐다,Politics
394, 국힘 탈당  이언주에게 손 내민 이재명  외연 확장 일환 ,Politics
395, 김건희 리스크 가 삼켜버린 대통령 신년 기자회견,Politics
396,  정부 저격수  이언주   년 만에 민주당 복당하나,Politics
397, 당권 재편기 에 또 등장한  윤심 압박   버텨낸 한동훈의 동력은 이런정치 ,Politics
398,금태섭  윤석열 한동훈 같은 뿌리 곧 봉합  이상민  이관섭 책임져야 ,Politics
399,비명 지역구 노리는 친명  이수진 양이원영 등 속속 도전장,Politics
