,titles,category
555,공지영  조국   잘못했다  한마디만 했어도  하태경  용기있다 ,Politics
556,  월부터 예비역 병장도 하사 진급 가능  동원훈련도 빼준다,Politics
557, 김정숙 여사가 명품백 받았다면  몰카건 뭐건 가야  했을 것   현장영상 ,Politics
558,   운영위서  강성희 강제퇴장    당무개입 강력질타,Politics
559,             강성희 사건 대통령실 입장 뺐다  보도 확인해보니,Politics
560,제 지대 이낙연  광주 출마  압박 불출마 뜻 접을까,Politics
561, 무등의 아침  박은식 비대위원  김건희 여사 명품백 의혹은 정치 공작 국고 귀속되어 있어 ,Politics
562,성남분당을  예비후보     김은혜 김민수와  대결 양상,Politics
563,박용진  김건희 여사 디올백 사과 필요 없다 ,Politics
564, 성추행 혐의 김태우 양산시의원  떠나라  사퇴요구 계속,Politics
565,예비역 병장   월부터 예비역 하사 될 수 있다,Politics
566,김경율 비대위원 사퇴할까    윤 한 갈등  해법  촉각 ,Politics
567,  한동훈  숨고르기   이철규  대통령 당무개입 한 적 없다  ,Politics
568,밀라노서 인종차별적 폭행 금품 갈취당해도 현지 영사관  도와줄 게 없다  ,Politics
569, 자막뉴스  들끓는   민심에  깜짝    한계 마주한 김정은,Politics
570,노인회장  애 안 키워봐 헛소리  카이스트 교수  대통령 국무총리는  ,Politics
571,이상민  대통령실 옹고집 부리면 안돼  금태섭  정치인들 말잔치   앵커리포트 ,Politics
572,신평  한동훈 사퇴 재차 촉구     중도확장성 가진 다른 인물 필요 ,Politics
573,공지영  조국  욕 먹으며 감쌌는데 배신감 진중권엔 미안해 ,Politics
574, 명품백 수수  논란 전말   쟁점은  앵커리포트 ,Politics
575,박지원  한동훈  결국 항복하고  용핵관  공천할 것 ,Politics
576,한동훈  광주항쟁 때 유치원생    임종석에 정면 반박   녹취록 ,Politics
577, 여당 정치인   배신  친명계의 잇따른 비명 의원 저격성 출마선언,Politics
578,최재성  조정식 민주당 사무총장  불출마 고려해봐야 ,Politics
579, 대통령 한동훈 대화 여부 주목 친윤  갈등 수습할 것 ,Politics
580,이철규       당무개입  비판에  심판놀이할 상황 아냐 약속대련  상상력 ,Politics
581,민주   방심위원 해촉은 방송장악  고발 헌법소원 검토 ,Politics
582,국회 운영위 불발에 박주민  대통령실에 묻지도 못하나 ,Politics
583, 뉴스앤이슈       초유의 충돌 사태    봉합  나서나 ,Politics
584, 윤 한 갈등 에 김경율 거취 주목 비대위원 유지 놓고 당내 이견,Politics
585,    갈등 에 김경율 거취 주목 비대위원 유지 놓고 당내 이견,Politics
586,   가장 아끼던 사람에게 뒤통수 맞아    한동훈  마이웨이    녹취록 ,Politics
587,  분만에 파행한 운영위 박주민  대통령실 이상하게 운영되고 있어 ,Politics
588, 강성희 폭력 사건    운영위 소집   분 만 산회,Politics
589,야   강성희 퇴장 논란  운영위 단독 소집   분 만에 파행,Politics
590, 김건희는 피해자   당무개입   도 당원  엄호 나선  ,Politics
591,이준석  한동훈  선거 끝나면 해코지당할 것 줄행랑이 답 ,Politics
592, 팩트체크   디올백은 국고   돌려주면 횡령   따져보니,Politics
593,민주당   윤  권력 사유화  한  사당화  도긴개긴 정권심판 세질 것  종합 ,Politics
594, 뉴스   유영하  대구 달서 갑에 출마한다고 박 전 대통령께 말씀드렸더니    ,Politics
595,껍데기만 남은 민주당의  시스템 공천  김지현의 정치언락 ,Politics
596,국민의힘   강성희 퇴장 논란 에  과장된 연기    막장 드라마 ,Politics
597,김종민  이낙연 신당과 합당  이번주 안에 결론 ,Politics
598, 친명  양이원영   비명  광명을 양기대에 도전장  민주당답지 않은 정치인 ,Politics
599, 지지율       한동훈 비대위  긍정        대통령 평가보다 높아,Politics
600,윤평중 교수  윤 대통령  한동훈 내치고 마이웨이 고집하면 정권심판론 태풍이 정부 여당 삼켜버릴 것 ,Politics
601,이철규  한동훈 사퇴설에  너무 나간 얘기 대통령 당무개입 없다 ,Politics
602,국힘 의원들의 속내  한동훈  윤석열보다 더 필요 ,Politics
603,육군회관     실 규모 간부숙소로 탈바꿈     년말 완공 목표,Politics
604,갈등 해법 고민하는 한동훈  당초 일정 바꿔 서천 화재현장 방문,Politics
605,안철수  김건희 여사 명품백 논란에  진정 어린 입장 표명 필요 ,Politics
606,홍익표    반도체 발언에  첨단산업 문 닫기로 작정  국제 웃음거리 ,Politics
607, 출신 박민식    한동훈  목숨 걸고 싸운 전우 단합 확신한다 ,Politics
608,   강성희 강제퇴장    사과해야    보이콧 경호처 불참,Politics
609, 뉴스포커스  한동훈  서천 화재현장 방문 민주  대통령실 당무 개입 ,Politics
610, 강성희 퇴장  운영위    불참으로 파행      국민 무시하는 행위 ,Politics
611,차주목 창원 마산회원 예비후보  국힘 예비후보 단일화 제안 ,Politics
612, 한동훈 사퇴  논란   김건희 리스크  더 키웠다,Politics
613, 한동훈 답할 차례  대통령실  김경율 문제 해결 안 됐다,Politics
614, 친명  양이원영  비명계 의원 지역구 출마 선언  당원이 심판해달라 ,Politics
615, 윤석열 한동훈 곧 단합할 것  확대 해석 진압 나선    여의도 라디오 ,Politics
616,박연수 천안함장  적 도발하면  그곳이 적들의 무덤 ,Politics
617, 강성희 강제퇴장  국회 무시      운영위 파행    규탄,Politics
618, 중도 확장    총선 악재  윤 한 간극 여전한  김건희 사과 ,Politics
619,이준석  총선 끝나면 해코지할 텐데 한동훈 무조건    계 가 답 ,Politics
620,  이상민    참모들 대오각성 필요 이관섭 사과해야 ,Politics
621,이용호  윤석열 한동훈 눈빛만 봐도 통하는 사이 갈등  만나면 해소 ,Politics
622,새 법무장관에 박성재 전 서울고검장 내정,Politics
623,안철수  명품가방 논란  진정 어린 입장 표명 필요해 ,Politics
624,    충돌이 약속 대련  김종민  맞다면 정치  단  정치타짜 ,Politics
625,김종민  이낙연  총선 출마해야 제 지대 통합은  월말  월초 ,Politics
626, 이태원 특별법 결과 봤어  민주  쌍특검법 재의결  타이밍  재기,Politics
627,   년  월   일 국보위 임명장 받으러 간 날  집권계획 감 잡았다 ,Politics
628,       신형 미사일 추가 지원 때 우크라 대공방어 무너질 우려 ,Politics
629,윤 한   김건희 사과 사천 논란  평행선 확전은 자제,Politics
630,이재명 피습수사 의혹 강성희 강퇴 논란에 국힘  음모론과 역할극 ,Politics
631, 전두환이     에 사과 안 하면 혼자라도 하겠다 ,Politics
632, 전두환     년  월 창당 시도  명확한 사실 ,Politics
633, 뉴스라이브   이재명 심장 뺏길 수 없다    이수진   성남행 ,Politics
634,정호용 특전사령관이  월   일   일 총   시간 광주에 머문 이유,Politics
635,한기호 국방위원장  본색 드러낸     비참한 안보관  이재명 대표 규탄한다 ,Politics
636, 결혼 않고 애 안 키워 헛소리  맹비난에  꼰대 막말  역풍,Politics
637, 뉴스라이브   실전   약속 대련    정치권 해석 분분,Politics
638,  용산  확전은 공멸    윤석열 한동훈  만남  주목,Politics
639, 뉴스라이브       확전   봉합  갈림길     공천까지 영향 받나 ,Politics
640,홍준표  김건희  마리 앙투아네트 비유는 망발 ,Politics
641, 양낙규의              북 미사일에 우크라이나 방공망 뚫리나,Politics
642, 현장영상  명품백 폭로 목사  김건희에 경악해 증거 채집 시작 ,Politics
643,친명 양이원영  비명 양기대에 도전장   이재명 체포안 때 왜 가결표 던졌나 ,Politics
644,소득 상관없이   억  서울시의회  파격  저출산 대책 보니,Politics
645, 간부부터 컴퓨터 끄고 퇴근  쪽지 보낸 최상목 부총리 세종팀의 정책워치 ,Politics
646,  한동훈 갈등  직접 만남으로 봉합   김건희 리스크  불씨는 여전,Politics
647,김 여사 대한 미안함  윤 대통령  사과 왜 이리 주저하나 ,Politics
648,서천화재에 한동훈 현장 방문  이재명  사고수습에 만전 ,Politics
649,홍익표  대통령  반도체 발언 에  세계적 조롱거리  중처법엔  야당 탓 거짓말 ,Politics
650,탁현민   디올백 반환 국고횡령  주장에  대통령기록관에 영원히 보존될 기세 ,Politics
651, 뉴스   천하람  김정숙 여사가 명품백 받았다면    한동훈은  걸리면 가야지  했을 것 ,Politics
652, 기호  번  쉽지 않다   원샷 통합 에서 멀어지는  제 지대 ,Politics
653,민주당원 모임  이성만 의원  우리에게 자부심 갖게 했다  복당 청원 제출,Politics
654, 강단   총선 악재   마이웨이  한동훈  민심 여파는,Politics
655,    충돌 정무기능 못한  섭 섭 라인  책임론 대두,Politics
656,홍익표  원전으로 전력 공급해 만드는 반도체  해외에 못팔아 ,Politics
657,이철규   김 여사 백 받았다  뒤집어씌우는 건 심해 언급 조심을 ,Politics
658, 미래대연합  김종민  제 지대 통합   월말  월초 이뤄질듯 ,Politics
659,여  야 운영위 소집 비판  강성희  대통령 계획 도발 ,Politics
660,공천 위해선  침묵 이 답    당무개입 논란에 잠잠한 국민의힘 이런정치 ,Politics
661,김근식  김경율 출마  사천 아닌 선당후사 갈등 봉합해야 ,Politics
662,인종차별 폭행당한  청년  영사관이 외면  외교부  사실 아니다  반박,Politics
663, 무임승차 폐지  이준석 때린 노인회장  이런 게 꼰대  비판한 노교수,Politics
664,홍익표      반도체 발언  세계적 조롱 천박한 경제관념 ,Politics
665,이철규  마리 앙투아네트 비유  책임있는 분들 자제해야  ,Politics
666,이용호  김건희 억울함 당이 몰라줘 불편했을 것  도 당원 ,Politics
667, 김건희 디올백 이 대통령기록물  관련법 찾아보니,Politics
668,윤석열 한동훈 충돌로 확실해진 것  실세는 김건희,Politics
669,박용진  김건희 여사 사과 필요 없다  왜 ,Politics
670,한동훈 편 든 안철수  나라 위해 싸워야 윤 대통령  정치 중립을 ,Politics
671, 정치쇼  금태섭      같은 뿌리  갈등 길지 않을 것 ,Politics
672, 정치쇼  박성민  한동훈 굴복하면 총선 패배  이기면   레임덕 ,Politics
673,김종민  윤석열 한동훈  갈등 핵심  김건희 디올백  약속대련 가능성 없다 ,Politics
674,이상민  김건희 의혹 해명하면 국민들도 이해 총선과 상관 없어 ,Politics
675, 친윤  이철규  한동훈 사퇴  기우 잘 마무리될 것 ,Politics
676,이철규 저격한 탁현민  김건희 디올백 영원히 보존될 기세 ,Politics
677,용산과 갈등  한동훈 거취두고 해석 분분,Politics
678, 윤핵관  이철규  한동훈 사퇴 논란에  소통 과정서 오해 잘 봉합될 것 ,Politics
679,이상민      갈등에  참모들 보필 못해 이관섭 실장 책임져야 ,Politics
680,안철수  김건희 명품가방 수수 대통령실 입장표명 필요 ,Politics
681,친윤 이철규  김경율  마녀사냥하듯 비유 자제해야  영상 ,Politics
682, 측근 이철규  한동훈과의 갈등 봉합될 것 소통 과정서 오해 ,Politics
683, 미래대연합  김종민  제 지대 통합 시점은  월 말  월 초 ,Politics
684, 몰카  정당성 내세운 최재영 목사  정을 의로 승화한 것  여러분이 이해해야 ,Politics
685,한동훈은 총선 앞둔  의  마지막 총알   의  사퇴  압박은 자기파멸 허민의 정치카페 ,Politics
686, 애 안 키워봐서  이준석 나무란 노인회장에  이병태 교수  자식 없는 대통령과 총리는  ,Politics
687,이재명  선거제 결단은  실리냐 명분이냐  아니면 절충안이냐  이런정치 ,Politics
688,박지원     민생토론회   분 전 불참 통보  세상에 이런 일이 ,Politics
689,이상민    뜻 전달한 참모 대오각성 필요 이관섭 책임져야 ,Politics
690,김건희 여사  디올백 사과 불가  간접적 목소리     몰카 범죄  인권위에 진정,Politics
691,대통령실은 왜 이  사진 을 보도하지 말라 했을까,Politics
692,김종민  이낙연 신당과 합당  이번주 안에는 결론 내야 ,Politics
693,김종혁  한동훈 멘탈  어후  강해요 ,Politics
694,민주 한민수     신년회견 대신    와 단독 인터뷰하면 약속대련 ,Politics
695,민주당 현역 불출마 두자릿수 무주공산 놓고 혼전 예고 이런정치 ,Politics
696,한  제 임기는 총선 이후까지 김 여사 관련 입장 변한 적 없어 ,Politics
697,   조국 지킴이  공지영  욕먹으며 감쌌는데  배신감 ,Politics
698, 관광객  서 괴한 습격 당했는데 영사관 반응  당혹  외교부  영사조력 제공 ,Politics
699, 정치쇼  이상민      갈등  이관섭 실장 책임져야 ,Politics
700,안철수  윤 한 만나서 풀되  디올백 이슈는 풀고가야 ,Politics
701,김종혁  한동훈 사퇴 가능성 낮아 이준석 김기현 때와 조건 달라 ,Politics
702, 겸손해연  이낙연이 달라졌다   화법 아니라 처지 바뀐 것 ,Politics
703,신평  한동훈  대권 욕심에 자신을 구겨넣어 한동훈으로 선거 치르면 극히 불리 ,Politics
704, 이런 게 꼰대들의 막말  이준석에 발끈한 노인회장  작심 비판 한 카이스트 교수,Politics
705, 애 안 키워봐서 저렇다  이준석  지하철 무상이용 폐지  비판한 노인회  역풍,Politics
706, 뉴스라이더     년 지기  윤석열 한동훈  어쩌다  정면충돌  하게 됐나 ,Politics
707, 찐윤  이철규  한동훈 용산  소통 과정서 오해 봉합 믿어 ,Politics
708, 전격시사  배진교 원내대표  정의당     입을 틀어막고 끌고 나가 스포트라이트를 받게 한 것은 바로 대통령실하고 경호처 ,Politics
709,탁현민  대한민국 국고에 잠자고 있는 디올백  깨어나라  ,Politics
710,비명계 윤영찬  이수진 성남 중원 출마  명분없는 선사후사 ,Politics
711, 해명하면 국민이 김건희 여사 이해할 것    이상민  국민에겐 균형감 있어 ,Politics
712,한  제 임기는 총선 이후까지 김 여사 관련 입장 변한 적 없어 ,Politics
713,미래대연합 김종민  제 지대 통합이 우선  안되면 선거연대 ,Politics
714,신평  한동훈 사퇴 요구  김건희 여사 때문 아니라 총선이 우려돼서 ,Politics
715,지금  부산 민심  멀쩡한 부산대서 치료받고 올라갔시믄 좋았을 긴데  ,Politics
716,둘로 쩍 갈라진 국힘  한동훈 책임져라   비서실장 물러나라 ,Politics
717,이상민  윤 뜻 전달한 참모 대오각성 필요 이관섭 책임져야 ,Politics
718, 전격시사  이철규 인재영입위원장  국민의힘     한동훈 비대위원장 사퇴논란 대통령실 당무 개입 월권 없고 있어서는 안돼 ,Politics
719,여야 공천룰 윤곽 초조한 충북 현역들,Politics
720,조국  한동훈 딸 무혐의에  피 토하는 심정 내 딸처럼 수사해야 ,Politics
721, 김민수 국민의힘 대변인 출마해야  성남 분당을 도 시의원들  지지선언,Politics
722,한동훈  사퇴 거부   윤 대통령과  파국 인가  봉합 인가  띵동 정국배달 ,Politics
723,여성 주자 거취 이상민 불이익 여부  격동 의 대전 유성구을,Politics
724, 지하세계      이낙연 이준석 소통 잘 돼  월말  월초 통합 윤곽   나는 정치인이다 ,Politics
725, 지하세계      조국  정치 논쟁거리 만들지 말아야   나는 정치인이다 ,Politics
726, 지하세계      이재명 불출마가 답  선  선이 죄는 아니잖아   나는 정치인이다 ,Politics
727,탁현민  김건희 디올백 영원히 보존될 기세  이철규  반환하면 국고횡령  발언 비판,Politics
728, 지하세계      이재명 좋아서 민주당 지지하는 것 아냐   싫어서 하는 거지   나는 정치인이다 ,Politics
729, 지하세계      윤 대통령 한동훈  실제상황 아니라면 겨룰수 없는 경지의 타짜   나는 정치인이다 ,Politics
730,겉으론  시스템 공천  우려  사퇴 분출  도화선 된  사과 요구 ,Politics
731,윤영찬  친명 이수진 성남 중원출마에  명분없는 선사후사 ,Politics
732,한국  미사일 개발 시작점  국산  호 로켓  황룡 을 아십니까 이현호 기자의 밀리터리 톡 ,Politics
733,윤 대통령 한동훈 충돌 후폭풍 회동 움직임도,Politics
734, 한동훈 후임  법무장관에 박성재 전 서울고검장 내정,Politics
735, 윤석열 한동훈  약속대련   가짜뉴스 음모론 퍼트리는 이준석식 정치 ,Politics
736,이철규   명품백  논란에  몰카 공작 피해자가 사과해야 하는가 ,Politics
737, 뉴스 돋보기   이러다 공멸  확전 자제 당정 갈등 봉합될까,Politics
738,이준석  한동훈    계 줄행랑이 답 ,Politics
739,한민수     신년 회견 대신     단독 인터뷰  그게 약속대련   한판승부 ,Politics
740,한 발 뺀 여권 주류  한동훈 사퇴  여론몰이 실패 ,Politics
741,신평   한동훈 교체  재차 거론  이대로면 국민의힘 총선 참패 ,Politics
742,박지원     토론회   분 전 불참 통보 세상에 이런 일이 ,Politics
743, 마음에 안 들면 나가야   선거 앞 교체 안 돼 ,Politics
744,서정욱  윤 한 갈등  한동훈의 차별화 때문 봉합   에 달려   한판승부 ,Politics
745, 대통령실 해부  기도  서 오 남   검찰 출신들 건재 ,Politics
746, 여의도 터뷰 박영선    강조한 반도체 클러스터  반드시 해야 하는 일 ,Politics
747,   친윤계   친한계 로 나뉘나 ,Politics
748,      일 만의 복귀  함장으로 돌아온 천안함 용사,Politics
749,한동훈 거취 갑론을박  물러날 것      버틸 것 ,Politics
750, 윤 대통령 한동훈  강 건넌 건 아냐  입장 차는 여전,Politics
751,이철규  한동훈 사퇴론에  제 위치에서 자기 역할 다하면 된다 ,Politics
752,이준석   한동훈도 해코지당할 가능성    계 줄행랑이 답   김은지의 뉴스   ,Politics
753,한  제 임기는 총선 이후까지 김 여사 관련 입장 변한 적 없어 ,Politics
754,벌써 네 번 바뀌었는데  윤심 논란 에 잇단 수난,Politics
755,민주당     당무개입 법적조치 쌍특검 재표결  투트랙 공세,Politics
756, 무조건 사퇴요구 아냐       과 갈등 봉합 수순,Politics
757,  과 결별은 공멸  인식     총선 위기감에  숨고르기   대통령실 한동훈 충돌 ,Politics
758,군불지피는 푸틴 방북설   한국 레버리지도 노렸나     기고 ,Politics
759,한동훈   과 정치적으로 결별하나 ,Politics
760, 사퇴 거부  한동훈   과 파국    극적 봉합  갈림길 ,Politics
761,   멘토  신평  한동훈 사퇴 요구  중도확장성 미약한 탓 ,Politics
762, 많은 사람이 참여하도록 열린 경선을   당이 전적으로 공천하고 책임도 져야  열린 경선과 그 적들 총선리포트 ,Politics
763,비서실장의    거취 압박  미스터리,Politics
764,돌아선     한동훈  홀로서기 성공할까,Politics
765, 실세 김건희  각인시킨 디올백 충돌,Politics
766,김경율  분별없는 발언 죄송 정제된 모습 보일 것 ,Politics
767, 윤 한 갈등 에  친윤   친한 으로 나뉘는 여당,Politics
768,소련제 레이더 미국 미사일 러 혼쭐낸  프랑켄슈타인 무기   밀리터리 브리핑 ,Politics
769,    길위에 김대중  관람  살아계셨다면 현 상황 통탄 ,Politics
770,디올백 논란 두고 여권서 제기되는  사과 불가론 ,Politics
771,한동훈의 거침없는 홀로서기    높은 지지율  총선 승리 명분에 탄력,Politics
772,이래도 사당화   한동훈   김경율 출마  지도부와 상의 ,Politics
773,조국  피 토하는 심정 내 딸만큼 한동훈 딸 수사해야 공정한 것 아닌가  ,Politics
774, 우리가 하는 건 정치가 아니다   잇따르는 불출마 반성문,Politics
775,   신의  수  숙고     마이 웨이  고수,Politics
776, 이러면 총선 하나마나   양측  강경 분위기 속 자제 모드,Politics
777,이준석  중국집에 전화기  대 있는 느낌 한동훈에 힘 쏠리는 모양새로 끝낼 것 ,Politics
778,민주당 비례 이수진  불출마 선언 하루 뒤  윤영찬 지역구 출마 ,Politics
779,한동훈  김경율 마포을 출마  발언   불공정 공천일까,Politics
780, 명품백  몰카 함정 취재 걸린 건 맞아  김영란법 적용은 논란,Politics
781, 사퇴 요구 거절  한동훈  김건희 여사 관련 입장 한 번도 변한 적 없어 ,Politics
782,여권  박  대통령 탄핵당했을 때처럼   공세 빌미 줄 수도 ,Politics
783,기로에 선   리더십  당 협력 없이는 힘들다,Politics
784,한동훈    가짜뉴스 운동권 정치  맹폭,Politics
785,여론도  당내서도 힘실어주지만 강대강 대치는 한동훈도 부담,Politics
786,한동훈  내 임기는 총선 이후까지 ,Politics
787,천안함 용사가 천안함장으로,Politics
788,민주  선거제 오락가락   병립형 준연동형 이어 권역별 비례 검토,Politics
789,      불법 당무개입   내부선      멀어지면 정권심판론 약화 ,Politics
790,   당대표 자꾸 없애면 총선 망해  위기감  경북의원 모임 취소,Politics
791,한동훈측  용산에 꺾이면 총선 무조건 진다    과 차별화 강공,Politics
792,김건희 여사   디올백 논란 사과 불가  지인에 메시지,Politics
793,대통령실     하필  김건희 리스크  건드리냐     화 많이 났다 ,Politics
794,조국  한동훈 딸  불송치 에 반발  내 딸처럼 수사해라 ,Politics
795,신평  용산 사퇴 요구   중도확장성 떨어져 총선 참패 우려 ,Politics
796, 윤 한 충돌  여권내 충격파 용산  한동훈과 회동 추진,Politics
797,영남 중진  한동훈이 책임져야  비윤  한  할 일하면 돼 ,Politics
798, 대통령실  선거중립 위반  여권 균열 파고드는 민주당,Politics
799,     김건희 명품백  충돌      버티기 들어가나,Politics
800,인천 계양을   명룡대전  본격화    원희룡  자기 정치 ,Politics
801,   년 전 천안함 가슴에 묻고 이젠 한 명의 전우도 잃지 않겠다 ,Politics
802,마하           날아갔다     고체연료 극초음속 미사일 실체,Politics
803,나경원 안철수도 비슷 갈등 때마다     찍어내기  논란,Politics
804,윤대통령  사천 불가론  재확인 대통령실  봉합 여지는 열어놔 ,Politics
805,한  제 임기는 총선 이후까지 김 여사 관련 입장 변한 적 없어 ,Politics
806, 투나잇이슈  한동훈  사퇴 요구 거절  야권  대통령 당무 개입  공세,Politics
807, 나이트포커스  한동훈 사퇴 요구 논란,Politics
808,한동훈 후임 법무 장관에 박성재   서울고검장 내정,Politics
809, 백브  핑   디올백 이 갈라놓은 호형호제   년  인간극장     ,Politics
810,민생토론 불참한  대통령 확전 봉합 갈림길 속 숙고 종합 ,Politics
811, 실전   약속대련  윤 한 충돌에 정치권 해석 분분,Politics
812,박지원  한동훈 사퇴 요구에  약속대련 아닌 실전 물러날 수밖에 없을 것 ,Politics
813,대한노인회장  이준석  결혼 안 해서 헛소리 석고대죄해야 ,Politics
814,한동훈 억울할까  대통령  사당화  지적에 사전 논의했다는 입장,Politics
815,여성 주자 거취 이상민 불이익 여부  격동 의 대전 유성구을,Politics
816, 전우는 가슴에  적은 바다에 묻겠다  신형 천안함장의 애끓는 다짐,Politics
817, 윤심 이냐   한심 이냐    김건희 리스크    내홍 고조,Politics
818, 박정규의 작살 김동연 지사가 왜 그럴까,Politics
819, 용산 뜻대로 꺾이면 총선 무조건 진다   한동훈 정면돌파 강공,Politics
820,   개월 동안 선장  번 바뀌는게 말이 돼   국힘 당대표 잔혹사,Politics
821,대통령실 한동훈   당정 갈등  봉합 어떻게 ,Politics
822,한  제 임기는 총선 이후까지 김 여사 관련 입장 변한 적 없어 ,Politics
823,이철규  국민들 진실을 몰라  사과 불필요 강조,Politics
824,신당과 친박  대구 경북에서 통할까 ,Politics
825,용산과 정면 충돌 후 첫 거래일 한동훈 테마주  줄줄이 하락,Politics
826,한동훈  평소 쓰던 아이폰 대신 갤럭시 꺼내 고동진과  셀카 ,Politics
827,윤석열 대통령  사당화  지적에 억울하다는 한동훈,Politics
828,한  당은 당의 일  정은 정의 일  차기 권력  마이웨이  걷나,Politics
829, 역린 된 김건희 세 글자  리스크 부메랑 이 됐다,Politics
830, 이준석  결혼 안 해 세상물정 모르고 헛소리  분노한 노인회장,Politics
831,이수진  비명 윤영찬 지역구 도전장 김홍걸 최종윤 불출마,Politics
