,titles,category
278,김경율  비대위 사퇴  또는  불출마  하면 갈등 봉합 ,Politics
279, 자막뉴스     온대서 기다렸는데 당했다    울분 토한 서천 상인들,Politics
280, 공관위원장  후보간 인신공격 엄격 조처  계파 과열경쟁 경고 종합 ,Politics
281,대통령실  서천 상인 분노에 해명  상인    명 만나 위로 ,Politics
282,친윤  김경율  비대위원 사퇴해야     사퇴 생각 없다 ,Politics
283,이낙연 신당 미래대연합 우선 합칠 듯,Politics
284,김은혜 김병욱    기 신도시 특별법  신경전  국민은 두 번 속지 않아      속기록 보고 오라 ,Politics
285, 격전지 속으로  보수세 확산이냐 저지냐  민심 가늠자  강동갑,Politics
286, 영상   한동훈       티셔츠 꽃게 제스쳐로 유난 떨더니 결국 반공 올드보이  ,Politics
287,이준석   차 약속대련은 한동훈 우세승    차전 있을 것 ,Politics
288, 아는기자 갈등 봉합 위한 대통령실의  두 가지 조건  ,Politics
289,민주당 공천 갈등은 현재진행형  수박 이어 멜론도 나가라 ,Politics
290, 친명  양이원영  비명 양기대에 도전장 민주  자객 출마  논란 지속,Politics
291,김경율   마리 앙투아네트  발언  김건희 여사와 비교 아냐 ,Politics
292, 뉴스추적  윤석열 한동훈 갈등 봉합 국면 관건은 김경율 거취,Politics
293, 아는기자 한동훈  윤 대통령에    도 인사 ,Politics
294,윤 대통령  참모진 설득에  한동훈 만나겠다 ,Politics
295,현역 출마 공약 러시  대전 정치권 총선 레이스 분주,Politics
296,친명  비명 지역구 잇단 출사표   집안싸움 위험 수위,Politics
297,또 비명 저격 출마 선언 과열 경쟁 우려에 홍익표  경쟁자 존중을 ,Politics
298,윤  같이 타자  한  자리 있습니까  열차 동승해 서울로,Politics
299,방심위      바이든 날리면  보도 재심의,Politics
300, 대통령 취임 후 국민의힘  원톱   번 교체    년지기 한동훈은   이슈  ,Politics
301,   사진만 찍고 갔다  항의 소동에  허은아    어깨 두드리며 상인 눈물 외면 ,Politics
302,대통령실 한동훈 갈등 수습 봉합 국면,Politics
303,김은혜  재건축이 국민 삶 망가뜨린다는 민주당 발상 김병욱  분당 주민 앞서 당부터 설득해야 ,Politics
304,민주당 공관위  국회의원 입후보자 간 인신공격 엄격히 조처 ,Politics
305,국방위원장   우리 북한 에     은  옆집 돌   이재명 망언  비참한 안보관 ,Politics
306,눈 맞으며   기다린 한동훈   폴더 인사 로 갈등 봉합,Politics
307,                응집력 급격히 약화된 친윤  홍위병 ,Politics
308,여야 원로들  당정  국민에 안정감 줘야  갈등만 거듭하면 무책임  지적,Politics
309,먼저 온 한동훈   에   도 인사 공멸 위기감에  극적인 봉합   당정 갈등 일단락 ,Politics
310, 명품백 의혹  사태 공개 사과는 없을 듯  제 부속실 설치 규모 시기 등 놓고 고심  당정 갈등 일단락 ,Politics
311,     도 인사 하자     어깨 툭  쳐  민생 얘기만 주고 받았다 ,Politics
312, 이재명이 제안  이언주  탈당  일만에 민주당 복당  고심 ,Politics
313, 이낙연 신당 에 싸늘한 호남  지대 광주 출마 압박,Politics
314,잿더미 바라보며 갈등 불끄기  어디 장소가 없어서  비판도,Politics
315,한동훈    존중 신뢰 변함없다    민생 고리로 파국 피했다,Politics
316,공지영  조국에 실망했다  하태경  진심으로 응원한다 ,Politics
317, 국정 기조 안 바꾸면 대통령도 불행해진다 ,Politics
318,트럼프 헤일리  양자구도 첫 대결,Politics
319,민주당  잿더미 된 시장을  브로맨스 화해쇼  배경으로 삼나 ,Politics
320,이재명  대장동 재판  출석했다 몸 상태 악화로 오후 퇴정 종합 ,Politics
321,  정청래  예비후보  명 후원회장  시끌   친명 또  자객 출마 ,Politics
322,보수논객마저 쓴소리    잿더미서 윤석열 한동훈 화해연극  ,Politics
323,   한동훈 만남이 주목적    일부 상인들  아무말 없이 갔다  분통,Politics
324,윤 대통령  장악력  훼손 윤 한 충돌 봉합의 정치적 후과는 ,Politics
325,이재명    일 만에 열린 대장동 재판서 중도 퇴정,Politics
326,     도 숙여 인사     어깨 툭 치며 악수,Politics
327,윤 대통령  열차 같이 탑시다     대통령 존중  일단 갈등 봉합,Politics
328, 윤석열 당선  등 공신 은 추미애인데      키운 임종석 노영민 석고대죄하라 ,Politics
329,    강성희 강퇴 진상규명  운영위 단독소집    불참에 파행,Politics
330, 파워게임       한동훈   조기 봉합  수순 뇌관은 여전 정다운의 뉴스톡 ,Politics
331, 함께 한 추억  특검 점퍼 입은     한동훈    도 인사 ,Politics
332, 영상   결혼 안 하고  애도 키워보지 않고 헛소리 남발  이준석 직격한 노인회장에 이병태 교수  정말 꼰대들의 막말 ,Politics
333,법무부 장관에 박성재 윤 대통령 대구 좌천 때 고검장,Politics
334,노영민  더이상 분열은 안 돼  총선 불출마 압박 일축,Politics
335,한 총리  전재산 기부  고 신언임 여사에  따뜻한 미소 오래 기억하리 ,Politics
336, 팩트체크  홍익표  원전 사용 반도체 해외 못팔아   애플은 원전도 가능,Politics
337,손잡거나 발목 잡거나 부산 여 현역 구청장 시너지  극과 극 ,Politics
338,문제는  국민 눈높이   당 용산  완전한 원팀  시간 걸릴 듯,Politics
339,민주 최고위원 정청래  후원회장 맡아  시끌  공천 계파 갈등 격화,Politics
340, 확전  피했지만  대통령 한동훈 화해 바라보는 두 시선,Politics
341,미래대연합   이낙연 신당  새로운미래와 이르면 이번 주 통합,Politics
342, 르포       정치적 말 대신 열차 동승으로  봉합  메시지,Politics
343,한동훈  열차에 자리 있습니까  윤석열  같이 올라가자 ,Politics
344, 화재 현장 따로 가면 이상해        회의 도중 한동훈과 만남 결정,Politics
345,금태섭 신당  노인 무임승차제 유지 확장   폐지  이준석과 입장차,Politics
346, 연합뉴스 이 시각 헤드라인         ,Politics
347,윤 한  깜짝 회동  막전막후 한 방문 소식에 윤 시간 앞당겨,Politics
348, 김건희 리스크 사천 논란    갈등 뇌관은 그대로,Politics
349,서천시장 일부 상인    사진만 찍고 가  항의 야권  현장 쇼통으로 복장만 터져 ,Politics
350,   시장 화재 현장은    한동훈  정치쇼 무대 아냐 ,Politics
351,갈등 노출 이틀 만에 조우   한동훈  신뢰 변함 없어 ,Politics
352,   열차 같이 탑시다    동승 화답     년 인연  파국 피했다,Politics
353,올  월부터   개월 복무 병사도 예비역 부사관 임용 가능,Politics
354,  저격수  변신한 이언주  년만에 민주당 귀환하나,Politics
355, 강성희 사태  끝까지 간다는 민주당   대통령 사과하라 ,Politics
356,제 지대 흐지부지될라    말 초가 통합 데드라인 ,Politics
357,김경율 비대위원    가 만만합니까  지역 정치권 성토 한목소리,Politics
358,  리포트  이준석  윤 한 갈등   같은 중국집  이론 불식 의도 ,Politics
359, 일만에 봉합된     갈등  공천권  등 이견 좁힐까,Politics
360,박지원  이낙연  호남  석도    한동훈  갈등 봉합  이준석     차전  이재명  이언주 복당 권유,Politics
361,   눈바람 맞으며    도 인사     어깨 툭치며 손 내밀어,Politics
362, 언제든 다시 터질 시한폭탄  용산  명품백 논란  해법 고심,Politics
363, 선거 지면 돌아갈 곳 없다  한동훈 배수진,Politics
364,박지원의 예언  한동훈  결국 항복하고  용핵관  대거 공천할 것 ,Politics
365,총선 앞 현실론에 갈등 봉합한      대통령님에 대해 깊은 존중과 신뢰 ,Politics
366, 대통령에 깊은 존중과 신뢰   김경율   명품백   물었더니   현장영상 ,Politics
367,   아침회의서  한동훈 서천 온다  보고 받고 흔쾌히  가자 ,Politics
368, 윤 한 갈등  봉합 수순 한  깊은 존중과 신뢰 변함 없어  종합 ,Politics
369, 탈당만 세 번  이언주 전 의원  돌고돌아 민주당 재입당할 듯,Politics
370,이재명  이언주에 복당 권유    진지하게 고민하겠다 ,Politics
371,윤 대통령  한 위원장 어깨  툭  미소  이틀 만에  화해 모드 ,Politics
372,조응천  친명 원외  수박 나가니까 친문 이해찬계도 나가라고 압박 ,Politics
373,서로 일정 조절한       도 인사에 상경열차도 동승,Politics
374,윤석열 한동훈  서천화재 공동 대처  갈등 불씨는 남아,Politics
375, 강성희 퇴장  국회 운영위 파행    경호법 위반       사과하라 ,Politics
376, 한동훈도 서천 온답니다    현장 방문 계획하던  과 통했다,Politics
377,한동훈이 여당 내 야당        갈등 봉합에도 불안한  ,Politics
378, 국힘 탈당  이언주에 이재명 복당 권유    고민하겠다 ,Politics
379,한동훈  대통령 깊은 존중 신뢰 변함없어   김건희 명품백 엔 침묵,Politics
380,비명 지역구 노리는 친명 비례 의원들    선명성  경쟁 조짐,Politics
381,이언주  이재명 복당 제안에 고심중 ,Politics
382, 단독   문재인 대통령의 입  강민석 전 청와대 대변인  민주당 입당,Politics
383,윤 대통령과 한동훈  정치적 갈등일까  인간적 손절일까  중립기어 라이브 ,Politics
384,민주  사천이든 공천이든 대통령실  총선 개입 ,Politics
385,김주영  지역 숙원 인하대병원 설립 논의   대학 측 설립 의지 확고 ,Politics
386, 외식비 줄이지 애들 공부시킬 돈은 안 줄여  민주로 간  전직 현대차 사장 의 비판,Politics
387, 분열은 공멸  공감대  갈등봉합 나선 당정  해법은 숙제,Politics
388,민주당  선거제  변심에 정의당  가시밭길 예고,Politics
389,갈등 봉합  윤 대통령 만난 한동훈  민생 얘기만 했다 ,Politics
390, 국회 우습나    분만에 끝난  강성희 강제 퇴장  운영위  여심야심 ,Politics
391,야권  화재 현장을 화해 현장 활용  공격,Politics
392,이재명   윤 정부 저격  이언주에 복당 권유    고민하겠다 ,Politics
393,  한동훈 충돌 봉합    김건희 성역화  되레 강화됐다,Politics
394, 국힘 탈당  이언주에게 손 내민 이재명  외연 확장 일환 ,Politics
395, 김건희 리스크 가 삼켜버린 대통령 신년 기자회견,Politics
396,  정부 저격수  이언주   년 만에 민주당 복당하나,Politics
397, 당권 재편기 에 또 등장한  윤심 압박   버텨낸 한동훈의 동력은 이런정치 ,Politics
398,금태섭  윤석열 한동훈 같은 뿌리 곧 봉합  이상민  이관섭 책임져야 ,Politics
399,비명 지역구 노리는 친명  이수진 양이원영 등 속속 도전장,Politics
400,이준석  개혁신당  인재영입위원장  겸임,Politics
401, 영상  민주당  대통령 당무 개입 사실  한동훈 위원장 본인 입으로 확인 ,Politics
402, 사사건건 플러스  천하람  지하철 없는 지역 고령층도 살펴야 통합 자체가 목표 아냐 ,Politics
403,정영환 공관위원장  줄세우기 공천 계파 공천 구태 끊어내겠다 ,Politics
404,추미애  윤석열 키운 임종석 노영민 석고대죄해야 ,Politics
405,친명계  비명계 지역구 잇단 도전장  공천 계파갈등 격화,Politics
406, 정치사색  윤대통령 한동훈 서천화재 공동 행보 갈등 봉합 분기점 맞나,Politics
407,새로운미래 미래대연합   정치개혁  고리로 야당발 신당 통합 시동,Politics
408,녹색 정의 연합정당  월  일 창당  사이비 제 세력과 달라 ,Politics
409,김근식  김건희  교통사고 피해자지만 차도냐 인도냐  따질 부분은 있어 ,Politics
410,이재명  국민의힘 탈당 이언주에 복당 권유  늦지 않게 결론 내릴 것 ,Politics
411,정의당  녹색당과 선거연합정당 공식화 제 지대와도 차별화 공언,Politics
412,한동훈  윤에 깊은 존중과 신뢰 마음 가져 변함 전혀 없어 ,Politics
413,한동훈  웃으며   도 폴더인사     악수 뒤  어깨 툭 ,Politics
414,김병욱  노후도시특별법 민주당 주도  김은혜 속기록 보고 오라 ,Politics
415, 선 노리는 주호영에  다선 피로감  공격하는 예비후보들 수성구갑       총선 격전지 속으로 ,Politics
416,안형환 전 의원  송파갑 출마  윤석열 정부 성공 뒷받침 ,Politics
417, 관광객  서 괴한 습격 외교부  미온적 대응  주장 부인 종합 ,Politics
418, 무기 거래  증거 없다 는 러 대사에 외교부  즉각 중단 강력 촉구 ,Politics
419,갈등 논란 후 첫 대면   한동훈  조기 봉합수순 돌입,Politics
420, 현장연결  한동훈  서천 화재 방문후 상경 취재진 질의응답,Politics
421, 현장영상   한동훈   대통령에 대해 존중 신뢰 마음   변함 없어 ,Politics
422, 뉴스큐  신평  한동훈  과도한 대선 행보가 갈등의 근본 ,Politics
423,    전용열차 동승해 서울로 피해 상인들  사진만 찍고 갔다 ,Politics
424,지속가능한 도시 및 미래지향적 신도시  우뚝   인천형 행정체제 개편  서구 검단구 ,Politics
425,이준석  약속대련  차전은 한동훈 우세승    차전 있을 것 ,Politics
426, 약속대련  주장 이어가는 이준석   차전 한동훈 우세승으로 끝날 것 ,Politics
427,국힘 최승재   대형마트 휴무 폐지  발표에  즉각 철회해야 ,Politics
428,      갈등 봉합  서천 화재현장 상인들  사람 우습게 보이나  분통  영상 ,Politics
429,이재명  이언주에  힘 합치자  복당 권유  진지하게 고민 중 ,Politics
430,이재명   국힘 탈당  이언주에 러브콜 외연확장 나선  ,Politics
431, 인터뷰전문  정청래  대통령 임기  년 남아 윤 한 갈등 결국은 대통령 승리로 끝날 듯 ,Politics
432,새미래 미래연  통합  군불   공동 창당대회 방안 논의중 ,Politics
433, 문재인 패권  이언주  이재명 권유에 복당 검토,Politics
434,   법무부 장관으로 지명한 박성재 전 서울고검장은 누구 ,Politics
435, 단독  중대재해법 기소된 원경환    검증위  적격 ,Politics
436,   도  인사하고 팔 두드리고     정면충돌 이틀 만에  봉합  ,Politics
437,민주당    조 규모  수도권 지상철도 지하화  공약 추진,Politics
438,이재명   윤정부 저격  이언주에 복당 권유 이언주  진지하게 고민  종합 ,Politics
439,  정부 포퓰리즘 남발   포퓰리즘  비판받던 이재명 역공 속내,Politics
440, 윤 대통령  반도체 등 첨단산업 망하게 하려 작정했나 ,Politics
441, 문재인 저격수  이언주  민주당 복당  이재명 권유,Politics
442, 양자 기술 로   극초음속 미사일 잡는다,Politics
443,비명계엔  친명 자객   이언주엔  러브콜   민주당다움 의 다른 잣대,Politics
444, 주목  여의도       험지 출마  전지현 전 행정관  이름값 하는 신세대 여전사 되겠다 ,Politics
445,이재명  대장동 백현동 재판 출석 뒤 건강상 이유로 일찍 퇴정,Politics
446,한동훈 눈발 속  폴더 인사     어깨 툭 치며 악수 청했다,Politics
447, 돌 하나 들겠다  조국도 신당  다음달   심 선고 에 쏠린 눈,Politics
448,안철수  명품 백 의혹  대통령실 입장표명 없으면 총선 악영향 ,Politics
449,  에 있는 엄마가 죽었대요  북한판  안네의 일기  담긴 참상,Politics
450,이준석 개혁신당 대표  인재영입위원장 겸임  예상 뛰어넘는 이들 합류 ,Politics
451,총선 앞 확전 자제    김건희 리스크  등 뇌관은 여전,Politics
452,윤  서천시장 화재에  특별재난지역 선포 가능 여부 검토  종합 ,Politics
453,안형환  서울 송파갑 출마 선언   정부 성공 뒷받침 ,Politics
454,외교부   서 폭행 당한 한국 관광객에 영사조력  외면 논란 반박 종합 ,Politics
455,이재명     탈당  이언주에 복당 권유 이언주  고민 중 ,Politics
456,박지원   이재명 비판  이낙연    김건희엔 못 해  꿀리는 것 있나  딱해  여의도초대석 ,Politics
457, 밀라노서 폭행 당했는데 영사관이 외면    외교부 반박 들어보니,Politics
458, 이 입은 점퍼   과 특검때 함께 입던 패딩이었다,Politics
459,천하람  김 여사 명품백 몰카  재판 증거로 쓸 수 있다 유죄 선고 충분 ,Politics
460, 르포   삶의 터전과 추억이 검은 재로  서천 특화시장 상인들  울분 절망 ,Politics
461,이재명     저격수  이언주에 직접 민주당 복당 권유,Politics
462,개혁신당  주요 당직자 인선 발표 이준석 대표 김숙향 부위원장 등,Politics
463,      사천논란  엿새 만에 서천 화재현장서 만나,Politics
464, 국회의원 입 틀어막기  대통령실 사과 논의도 틀어막혔다,Politics
465,한동훈   도 폴더인사    어깨 툭 충돌 이틀만에 손 잡았다,Politics
466,  법무장관에 박성재 지명  한동훈 조우하며 후임 인선,Politics
467,윤  한동훈 어깨를 두드리고 열차에 동반 탑승 갈등 봉합 수순,Politics
468,악수 나누고  어깨 툭   갈등 봉합 제스처 보인  대통령 한동훈 위원장,Politics
469,일정 바꿔   동행한   직접  갈등 마침표  찍나,Politics
470,김건희  윤석열 한동훈 봉합 승인   김은지의 뉴스   ,Politics
471,조국 수호했던 공지영  욕 먹으며 감쌌는데 배신감 ,Politics
472,우원식    한동훈 약속대련 김건희 특검 덮기 위한 연극 ,Politics
473, 뉴스       폭설 맞으며   대통령 기다리는 한동훈,Politics
474,대통령실 한동훈 충돌  출구전략 놓고 의견 분분,Politics
475,이재명   김건희 쓴소리  이언주에게 민주당 복당 권유,Politics
476,이준석  국민의힘  대형 부도의 서막 공천 파동 또 날 것 ,Politics
477,대한노인회 회장  이준석  결혼 안 해봐서 헛소리 남발 ,Politics
478,이재명   국민의힘 탈당  이언주에 복당 권유   일 만날듯,Politics
479, 대통령실 성토장  된 운영위 야  당  쌓인 불만 터뜨렸다,Politics
480, 대통령실 성토장  된 운영위 야  당  쌓인 불만 터뜨렸다,Politics
481,이준석   사퇴 요구  약속대련  차전은 한동훈 우세승 ,Politics
482,  정부 저격  이언주  내일 민주당 복당 검토 이재명 권유,Politics
483, 미래대연합  김종민  이낙연 신당과 합당  이번주 내 결론내야 ,Politics
484,이준석   차전  약속대련 은 한동훈 우세승으로 끝나고    차전 있을 것 ,Politics
485,  저격  이언주  이재명에 복당 권유 받았다  진지하게 고민 중 ,Politics
486, 기자수첩   망각 강요시대   이태원 참사 특별법과 김건희 특검법  얼굴 사라진 테러범 ,Politics
487,이준석  약속대련  차전은 한동훈 우세승    차전도 있을 것 ,Politics
488,윤 한  서천 화재현장 함께 점검   민주  경선 경쟁 본격화,Politics
489,   책임론  꺼낸 추미애  임종석 노영민 출마 안돼 ,Politics
490, 강성희 과잉 제압  운영위  여당 불참에   분만에 파행,Politics
491,천하람  김정숙 여사가 받았다면  한동훈  걸리면 가야지  했을 것 ,Politics
492,채널    대통령 발언 직접 인용  단독 보도  어떻게 나왔을까,Politics
493, 조국 지킴이  공지영  진중권에 뒤늦은 사과 왜 ,Politics
494,고민정     바보 같이 뒤통수 맞냐 소리 들어   누가 그런 말을  딱 한 사람뿐  여의도초대석 ,Politics
495, 김건희 여사  쓴소리 이언주 민주당 복당할 듯,Politics
496, 에     굽힌 한동훈 서천 화재현장서 갈등 봉합 제스처,Politics
497,이재명  이언주에 복당 권유 정성호  이언주 용기에 박수 ,Politics
498,비명 지역구 사냥 나선 친명들  총선 앞두고   내분 본격화,Politics
499,   신임 법무부 장관 후보자에 박성재 전 고검장 지명,Politics
500, 뉴스외전 정치 맞수다  윤 한  전격 만남  한동훈  입장 전환 어려워      김 여사 문제로 제대로 붙을 것 ,Politics
501, 단독  대통령  같이 타자  한동훈  자리 있습니까  열차 동승,Politics
502,  법무부 장관에 박성재 전 서울고검장 지명,Politics
503, 뉴스       화재현장에서 만난 윤석열 한동훈   갈등설 진화  ,Politics
504,한동훈  폴더 인사 에   대통령  어깨 툭 치며 악수 청했다,Politics
505, 강성희 제압사태  국회 운영위 파행     경호법 위반       사과해야 ,Politics
506, 윤 한 갈등 에 김경율 거취는  비대위원직 사퇴로 이어지나,Politics
507, 단독  해병대사령관   박정훈 대령 항명 재판  증인 출석 연기 신청,Politics
508,실금 갔던    년 지기   대통령 한동훈  갈등 봉합 수순 ,Politics
509, 강성희 강제퇴장  운영위   불참으로 파행    국민과 국회 무시 ,Politics
510, 김 여사   사과하면 불리  메시지  디올백이 대통령 기록물  논란,Politics
511,정치  번지  종로 에 여야 후보 난립,Politics
512, 마이웨이  한동훈에 당정 갈등 어디로   여야    당무 개입  공방  앵커리포트 ,Politics
513, 속보      한동훈  후임 법무장관에 박성재 전 서울고검장 지명,Politics
514,공지영  조국  그런 사람일 거라곤   진중권에 미안해 ,Politics
515,    갈등 봉합 국면   친윤계  반응 자제하며 갈등설 진화,Politics
516,김무성  보수 분열 안하면 총선 승리 김건희 명품백 사과해야   월간중앙  특별 인터뷰,Politics
517,이준석  연일      약속대련설  설파에 안간 힘  왜 ,Politics
518,노인회장  이준석  애 안 키워봐 헛소리 에 카이스트 교수  대통령과 국무총리도  ,Politics
519,  한동훈   갈등설  이틀 만에 끌어안았다,Politics
520,류희림 방심위원장  거짓말  논란  방심위 노조  류 위원장 동생 관련 보고서  공개,Politics
521,대장동 재판 재개  법정서 다시 만난 이재명과 유동규,Politics
522,공지영  조국 지지  후회   욕 먹으며 감쌌는데 배신감 커 ,Politics
523, 연합뉴스 이 시각 헤드라인         ,Politics
524,이철규  한동훈 사퇴 요구에  소통의 오해 잘 수습될 것 ,Politics
525,공지영  요즘 이준석 예뻐  과거 진중권에 미안  하태경  용기있는 고백 ,Politics
526,   한동훈과 함께 서천시장 화재현장 점검 엿새만에 갈등 봉합 수순,Politics
527, 바이든 날리면  심의 돌입 방심위     윤 대통령  피해자될 것 ,Politics
528, 강펀치  류호정  이준석과 젠더 갈등 해소 위해 잘 해보고 싶어 ,Politics
529,하태경  공지영  조국 옹호  사과에  용기있는 고백에 박수 ,Politics
530,민주당  김건희 여사가 몰카 피해자  애초에 가방은 왜 받았나 ,Politics
531,한기호     이재명 치료 서울대병원에도      당시 만행 ,Politics
532,   명대 출산율에 서울시의회  저출생정책 소득기준 폐지 제안 종합 ,Politics
533,야당  강성희 퇴장 논란  운영위 단독 소집   여 분 만에 파행,Politics
534,소득 무관   세까지  억원 서울시의회  파격  저출산 대책 종합 ,Politics
535, 육군회관    년 만에 역사속으로     년말  간부숙소  리모델링  명칭도 변경,Politics
536,민주   방심위원 해촉 재가에  방송장악  고발 헌법소원 검토 ,Politics
537,민주당  야권 추천 방심위원 해촉은 방송장악 ,Politics
538, 친윤 핵심  이철규  한동훈 사퇴설에 입 열었다 방송에 나와 한 말,Politics
539,동해에 드리운 방사능 해일의 위험  무기로 읽는 세상 ,Politics
540,김근식  김건희 교통사고 피해자  신호위반 여부도 중요 ,Politics
541, 친윤 핵심  이철규  윤 한 갈등에  소통 과정에 조금 오해 잘 봉합될 것 ,Politics
542, 현장영상     한동훈  서천 화재 현장 방문    사퇴 충돌  뒤 만남에 주목,Politics
543, 강성희 퇴장 논란  운영위    분 만에 파행,Politics
544,충돌 이틀 만에 포옹한   한동훈 서천 화재 현장 함께 점검,Politics
545, 사퇴 거부  한동훈  당무 정상 수행   대응 방안 고심할 듯,Politics
546,공지영  조국  그런 사람일 거라곤 그렇다고 전향은 아냐 ,Politics
547,     실시간뉴스  한동훈  서천 화재 현장 방문   당무 계속,Politics
548,이상민  이관섭 책임져야  안철수  윤 한 만나서 풀어야 ,Politics
549,중국 해양조사선   친중 성향  몰디브행 인도  밀착 감시 중 ,Politics
550,한동훈   도 인사   은 어깨 툭   충돌 사태 봉합 나서나,Politics
551,홍남표 창원시장  선거법 위반  선고 앞두고 변론 재개,Politics
552,민주  김건희 여사가  몰카 피해자   애초에 가방 왜 받았냐 ,Politics
553,김건희   사과 불가  지인에 메시지    몰카 범죄  인권위에 진정,Politics
554,안철수도 이상민도  김건희 디올백 논란 해명해야 ,Politics
