,titles,category
832,이준석부터 한동훈까지 반복되는 여당  지도부 잔혹사 ,Politics
833,날 세운 친윤계  피해자가 사과하나   한동훈 사퇴론  띄우기,Politics
834,이상민  한동훈과 갈등  최대 피해자는  대통령   비판    물먹이는 것 ,Politics
835,이언주      약속대련   김건희 특검법  받는지를 보면 된다 ,Politics
836,겉으론  공천 우려 라지만  사퇴 분출  도화선 된  사과 요구 ,Politics
837,용산  사퇴 요구 에 한동훈 공개 맞대응  제 임기는 총선 후까지 ,Politics
838, 최측근  한동훈도  유례없는 당정갈등 어디까지,Politics
839, 광주 전남 주간정치  거세지는 이낙연 출마 압박 광주에 나오나 ,Politics
840,대통령에 휘둘리는 집권여당 대표  정치 중립 위반 ,Politics
841, 뉴스레터   신경민  낙준연대  통큰양보  구걸은 없어  유연한 원칙  ,Politics
842, 명품백 의혹  어찌할까 여당내 혼란 극심,Politics
843,한동훈  총선 이후까지 임기  사퇴 거부 윤 대통령  돌연 일정 취소,Politics
844, 짚어봅시다       명품백 충돌    의혹 해소 못하면 필패 ,Politics
845,  리포트  좌천길 함께 갔던 윤 한  이제는 갈림길에,Politics
846,  기 신도시 결자해지  김은혜  홍보수석  성남분당  출마 공식화,Politics
847, 갈등 촉발  김경율  사과했지만 김건희 리스크에는  변한 것 없다 ,Politics
848,김홍걸  이중잣대 검증  비판 민주 현역   명째 불출마 선언,Politics
849, 여랑야랑 한동훈  아이폰 대신 갤럭시    공천 여론조사  쏟아지는  감점  전화,Politics
850, 생생플러스  이용호     비온 뒤 땅 굳어질 것   강성희 운동권식 도발  ,Politics
851, 정면승부  태영호  한동훈 없으면  이준석 대표만 주목 받아 ,Politics
852,친명 내부도 분열   조정식 불출마하라 ,Politics
853, 아는기자    년 지기  윤 한 갈등  무한 신뢰  금 가나 ,Politics
854,명품백 건넨 목사  영부인 불량한 모습에 폭로 결심 ,Politics
855,한동훈  김경율 원희룡 출마 발표 전 사전 논의했다  사당화  억울 ,Politics
856,친윤 사퇴 압박에 한동훈  임기 완주  대통령실 추가 공세  자제 ,Politics
857, 단독  뒤통수 맞았다더라  윤 대통령  심경 토로,Politics
858, 아는기자 사퇴 얘기 나온   인 회동   무슨 일이 ,Politics
859, 뉴스추적  확전 막았지만 갈등 불씨 여전   한동훈 그립  더 세게 ,Politics
860, 단독  비서실장이 사퇴 요구      한동훈이 먼저 질문 ,Politics
861,이준석 김기현 전철 밟을 땐 치명상  확실한 차기 주자로 발돋움  갈림길   대통령실 한동훈 충돌 ,Politics
862,격분한 노인회장  이준석  결혼 안하고 정치권서 무위도식해 헛소리 ,Politics
863,김경율 공천에  윤석열     한동훈  승자 갈린다   김은지의 뉴스   ,Politics
864, 내부 공멸 위기감에  총선   일도 안남아 지도부 흔들리면 선거에 악영향 ,Politics
865,확전 경계하는 대통령실   극적 화해 냐  결별 강행 이냐 기로  대통령실 한동훈 충돌 ,Politics
866, 홀로서기  천명한 한동훈   확전땐 공멸  갈등 봉합 나서,Politics
867,박지원  한동훈  대통령병   한 하늘에 두 태양 용납 안 돼  자업자득 측면도  여의도초대석 ,Politics
868,여  비대위원장 사퇴 요구 로 시끌 한동훈  임기 총선 후까지 ,Politics
869, 마이웨이  못박은 한동훈 여권  파국과 봉합 사이  혼돈 ,Politics
870,여성 주자 거취 이상민 불이익 여부  격동 의 대전 유성구을,Politics
871, 단독  사당화  지적에 한동훈  정면 반박,Politics
872, 단독  대통령 뒷배로 줄세우기 오해  윤 대통령   한동훈 사당화  우려,Politics
873, 명품가방 전달 촬영  최재영 목사  박근혜 탄핵도  몰카 서 시작 ,Politics
874,이번엔  친윤  친한  국민의힘  이대론 선거 못 치러 ,Politics
875, 명품백 의혹 토끼몰이 안돼     한동훈에 발등 찍힌    입장 표명은 언제 ,Politics
876,총선   일 앞두고      정면충돌 당내서도 엇갈린 평가,Politics
877,신평  한동훈  나라 지도자 될 수 있단 환상에 젖어 스스로 물러나야 ,Politics
878, 김건희 지키기가 국정 과제인가  본말 전도된 윤 대통령  제왕정치 ,Politics
879,버티는 한동훈   친윤  손절에  식물 위원장  되나,Politics
880, 영상   한동훈 사퇴 요구 사실   질문에  저 그런 거 잘 확인 안 해요 ,Politics
881, 단독   지금 분열은 공멸이다  용산 한동훈 곧 만난다,Politics
882,이채익 의원   도면 유출  한화오션도 방사청 제재 필요  종합 ,Politics
883,공천 경쟁 본격화   경선 감산점   중진 페널티  등 변수 촉각,Politics
884, 윤    한  강대강 충돌  총선 앞 여권 대혼돈,Politics
885, 우리 동네 총선 라인업  전국구로 떠오른 사상   찐윤  장제원 떠난 자리 출사표 넘쳐,Politics
886,내홍 이면엔 친윤       공천 신경전   중진들 대책 고심,Politics
887, 불출마  최종윤  우리가 하는 건 정치도 민주주의도 아니다  친명 비명 갈등 속 잇따르는  반성문 ,Politics
888,민주 초선    번째 불출마  공천 갈등에도 지도부 친명은  잠잠 ,Politics
889, 한동훈 낙마 땐    석도 못 건져   총선 위기감에 일단  숨 고르기 ,Politics
890,침묵의    마이웨이   당정  확전 봉합  갈림길,Politics
891,문재인  김대중 대통령 살아계신다면 지금 상황 통탄 ,Politics
892,  오태원  발달장애인 낳은 게 죄  망언 이재명  분노 금할 수 없어 ,Politics
893, 정치쇼 약속대련   윤석열 한동훈 충돌 에 야권 계산 분주,Politics
894,함장으로 돌아온 천안함 용사    도발 땐 수장 시킬 것 ,Politics
895,이재명     선거 노골적 개입    정치중립 위반 법적 대응 검토,Politics
896, 친명  비례의원  비명  자객 출마 선언  러시,Politics
897, 찍히면 죽는다  윤 대통령 당무개입 잔혹사,Politics
898,     갈등 에   온도 차   한동훈 책임져야      사퇴하면 풍비박산 ,Politics
899,참모들과 회의한    한동훈 언급은 안 했다,Politics
900,대통령실의  김건희 성역화  윤 한  미묘한  차이에 과잉대응,Politics
901, 연출된 충돌   정치적 이벤트  권력투쟁  윤 한 갈등 다양한 해석,Politics
902,김형근 울산 남구을 예비후보  김기현  본인 의혹부터 밝혀야 ,Politics
903, 마이웨이  선언한 한동훈  총선국면 당정갈등 어떻게 풀까,Politics
904,침묵의    마이웨이   당정 출돌  봉합  갈림길,Politics
905,노인회장  이준석  결혼 안 해서 헛소리  석고대죄하라 ,Politics
906, 결혼 안 해본 이준석  세상 물정 몰라  대한노인회장 분노,Politics
907,민주 초선    번째 불출마에도  지도부 친명은 잠잠,Politics
908,  일정취소    마이웨이 총선 앞 여권 격랑 속으로,Politics
909,친윤의  대표 찍어내기  이번에도 성공  사뭇 다른 분위기,Politics
910,국힘 이철규 의원  명품백 내전  확전방지 가교역,Politics
911, 여의뷰   윤석열 한동훈 파국  위기 돌파 열쇠는,Politics
912, 애 키워보지도 않고  헛소리 남발  노인회장  이준석에 일갈,Politics
913, 분열땐 필패  위기감          년 총선 악몽 에 숨고르기,Politics
914,송영길의  옥중 창당  비례 떴다방 대열 합류,Politics
915,    충돌에 기름붓는 민주당  공천개입 법적조치 검토 ,Politics
916,      총선 열전지대  양보할 수 없는 부산 최대 의석 노리는 민주  수성 나선 국민의힘,Politics
917, 한동훈 낙마 땐    석도 못 건져  총선 위기감에 숨 고르는 여권,Politics
918,   사퇴  온도차 드러내는 친윤    비윤 공천 때문 ,Politics
919, 한동훈 책임져야     사퇴하면 풍비박산  묘하게 갈린  ,Politics
920,김정은의  헤어질 결심   동족      두 국가  갈림길에 선 남한,Politics
921, 한동훈 내치면 국힘 지지 포기   이간질 선동    팬클럽 의견 분분,Politics
922,국민의힘 의원들  눈치싸움   친윤계와 친한계 분리 조짐,Politics
923, 성폭력  차 가해자는 총선 못 뛴다   여야  성폭력 배제 공천 시동거나,Politics
924,    아들도 친구가 녹음 폭로  최재영 목사가 밝힌  김건희 명품백 전말 ,Politics
925, 단독  이해찬  이재명 만남 뒤 하루 만에 김부겸과 회동,Politics
926, 먼저 간 전우는 가슴에  적은 바다에 묻겠다 ,Politics
927,이준석  한동훈 사퇴요구 약속대련  강성희 과잉 제압  운영위 소집   삼성전자   현대차 인재 영입,Politics
928,현근택 가고 이수진 왔다     윤영찬  공정하게 경쟁하겠다 ,Politics
929,조국 김남국    탄핵  언급  중전마마 건드리니 사퇴 종용 ,Politics
930,   한동훈과 같이 갈 수 없다  봉합 할 수 있는 단계 아냐 ,Politics
931,이재명   장애인 왜 낳았나  구청장 발언에  분노 금할 수 없어 ,Politics
932,  한동훈 갈등  봉합이냐 파국이냐  갈림길    확전 자제,Politics
933,이언주    한동훈 충돌  지지율 변화 없어서  쇼  필요했을 수도 ,Politics
934, 단 한 명의 전우도 잃지 않고 승리할 것  천안함 폭침 때 작전관  새 함장에,Politics
935,윤 한이 수사한 박근혜 공천개입은 유죄인데 대통령실이 당무 개입 ,Politics
936,사진 한 장 없이  방사능 쓰나미    핵어뢰  해일  미스터리,Politics
937,한동훈  민주     피습 수사  입맛대로 안 해주니 경찰 악마화 ,Politics
938, 당은 당의 일  정은 정의 일   한동훈의  마이웨이    차기 권력 향해 조기 시동거나,Politics
939,당정 갈등 어디까지  공멸 안돼  자제 속 양측 모두  부글부글 ,Politics
940, 는 삼성 고동진  는 현대 공영운 정치권  잇단 기업가 영입,Politics
941, 김영선  한동훈  이탈에 책임져야 어떻게 찾아온 정권인데 ,Politics
942, 한동훈 사퇴 파문  보더니    궁중 사극   고릴라 싸움 ,Politics
943, 사퇴 거부  한동훈  선민후사  대통령실  원만한 수습 노력 ,Politics
944,김건희 명품백 촬영  기획자 가 국회에서 밝힌  사건의 전말 ,Politics
945, 단독  조수진 국민의힘 의원   명예훼손 혐의  피소,Politics
946,한동훈  사퇴 거부하며  과 차별화     제 임기는 총선 후까지 ,Politics
947, 김건희 발언  했다가 고개 숙인 김경률  제 거친 언행 죄송하다 ,Politics
948,민주     갈등에  대통령 당무개입은 불법 법적조치 검토  종합 ,Politics
949, 이재명     노골적으로 선거 개입      김건희 리스크  집중공략나선 민주,Politics
950,윤석열 한동훈 충돌에   우려 친윤계  봉합해야  목소리,Politics
951,조국 이어 김남국도   탄핵 거론  진지하게 고민해야 ,Politics
952,음주운전 전과  범에 아동학대까지 누굴 뽑나   취재후 ,Politics
953,여권 신 구 권력 충돌 일파만파 윤 대통령 당무개입 논란 확산,Politics
954,한동훈  비대위원장직 수행 의지 밝혀  사퇴 거절  임기 총선 후까지 ,Politics
955,  한동훈  불안한 휴전  용산  일단 지켜본다 ,Politics
956,당 검증 통과 못한 김홍걸 민주당 의원  총선 불출마 ,Politics
957,제 지대 빅텐트 분수령 합당보다 느슨한 연대 가능성 ,Politics
958, 여론조사 꽃  한동훈 발언  신뢰하지 않는다            신뢰한다       ,Politics
959, 뉴스   한동훈   김건희 리스크  입장 변화  내 입장은 변한 적 없다 ,Politics
960,이상민 의원  한동훈 위원장 사퇴하면 국민의힘은 풍비박산 ,Politics
961, 갤럭시 신화  고동진   입당  아이폰 유저  한동훈  갤럭시폰으로 셀카,Politics
962,간접적 목소리 내는 김건희 여사측  몰카 공작 가해자 사과 먼저 ,Politics
963,김경율  마리 앙투아네트  발언 사과  김건희 사과  요구는  변함 없다 ,Politics
964, 한동훈   대통령의 뜻이 뭐냐  물어  결별  극적봉합  숨고르기,Politics
965,야 당   강성희 과잉 제압  공동대응   김용현 경호처장 파면 요구,Politics
966, 뉴스큐  최재성    한동훈  약속대련이라기엔 위험 무모   핵전쟁 급 실전 ,Politics
967,    삼남  김홍걸 총선 불출마   검증 에 막혀,Politics
968, 발달장애인 왜 낳았노  구청장 논란에 이재명  민주당이었다면 곧바로 징계 ,Politics
969,개혁신당 새로운 선택  공수처 폐지 특수부 축소    개혁 공약,Politics
970, 여의도 번지  한동훈  사퇴 요구 거절 제 임기는 총선 이후 이어져 ,Politics
971, 비전 대화   반민주 검찰개혁  첫 삽 뜬 제 지대 빅텐트   동상이몽은 여전,Politics
972,삼성 고동진 현대차 공영운    대기업 사장  나란히 여야 영입,Politics
973,김홍걸 최종윤 총선 불출마  현역   명째,Politics
974,윤석열 한동훈 갈등에 민주  대놓고 당무개입 중대 불법 ,Politics
975,공천 논란 내세웠지만 윤 대통령  역린  건드린 대가라는 시각 지배적,Politics
976,   결국 마이웨이하나  총선  당정 불협화음은 왕부담,Politics
977,비례 이수진  비명 윤영찬 지역구 출마에 티격태격,Politics
978, 영상  한동훈  운동권 특권 세력 상당 부분 종북 성향 ,Politics
979,이준석 이낙연의 제 지대  동상이몽  정책으로  연대  물꼬틀까,Politics
980,용산과 멀어진 한동훈 내막은  약속대련    권력투쟁,Politics
981, 윤 한 갈등 에 한동훈 거취 의견 분분  물러날 것      버틸 것 ,Politics
982,     남  김홍걸  총선 불출마 선언 초선 최종윤도 불출마,Politics
983,여 삼성전자 고동진 야 현대차 공영운 나란히 재계 인사 영입,Politics
984,   는 선수 늘기만 바라  김경율   분별없는 발언  공식 사과,Politics
985, 나는 왜 명품백을 전달했나  공개석상 나온 최재영 목사  현장영상 ,Politics
986,  첨단정찰기     핵어뢰 시험  주장 사흘 만에 출격 추가 도발 징후 포착 ,Politics
987,대통령실 사퇴 요구 재차 거절한 한동훈 선거 목전  대형 악재 에 촉각,Politics
988,또 다시  정면 충돌    여당 대표는  독이 든 성배    앵커리포트 ,Politics
989, 윤석열 한동훈  강대강 대치 총선정국  시계제로   용산실록 ,Politics
990,박지원  한동훈  김건희 마마 역린 건드려  절대 못 살아남아  그게 권력 속성  여의도초대석 ,Politics
991,개혁신당 미래대연합 새로운미래  자 먼저 대화 테이블 구성,Politics
992, 영상     일 만에 천안함 함장으로 돌아온 박연수 중령   전우들 명예 걸고    ,Politics
993,금태섭  민주당식 가짜 검찰개혁 끝내야 공수처 폐지하자 ,Politics
994,위기의 한동훈에  비주류  하태경  소방수  출동   측근  한동훈 비판 에  이간질 말라  일침,Politics
995,   민생토론회 불참   대통령실  한동훈  금도 넘었다 ,Politics
996,   대립에 제 지대 이낙연 이준석 한목소리 비판,Politics
997,한동훈 효과  글쎄  오차 범위 밖으로 벌어진  여야 지지율   싸움 ,Politics
998,이상민      갈등  대통령이 손해  한동훈 사퇴하면 국힘 풍비박산 ,Politics
